{
  "case_id": "case_clio_003",
  "chat_id": "123456789",
  "status": "audio_analysed",
  "round": 0,
  "created_at": "2026-10-20T09:00:00+01:00",
  "user_input": {
    "text": "Ma Clio 2015 fait parfois un petit bruit au démarrage, je ne sais pas si c'est grave.",
    "voice_transcript": null,
    "language": "fr",
    "audio_file_id": "EXAMPLE_FILE_ID"
  },
  "vehicle": {
    "make": "Renault",
    "model": "Clio",
    "year": 2015,
    "fuel": "diesel",
    "mileage_km": null
  },
  "symptom": {
    "description": "petit bruit par moments au démarrage, pas à chaque fois",
    "context": "startup",
    "missing_info": []
  },
  "audio": {
    "status": "ok",
    "label": "normal_startup",
    "context": "startup",
    "top3": [
      {
        "label": "normal_startup",
        "prob": 0.62
      },
      {
        "label": "dead_battery",
        "prob": 0.2
      },
      {
        "label": "bad_ignition",
        "prob": 0.1
      }
    ],
    "anomaly_score": 0.55,
    "confidence": "medium",
    "description": {
      "duration_s": 12.0,
      "dominant_freq_hz": 120.0,
      "periodic": false,
      "period_ms": null,
      "speech_ratio": 0.05,
      "summary": "4 s recording, short low click at key turn, then a normal start."
    },
    "model_version": "mock-0.1",
    "warnings": []
  }
}