{
  "case_id": "case_clio_010",
  "chat_id": "123456789",
  "status": "audio_analysed",
  "round": 0,
  "created_at": "2026-10-20T09:00:00+01:00",
  "user_input": {
    "text": "Le témoin de pression d'huile s'allume dans les virages sur ma Clio diesel.",
    "voice_transcript": null,
    "language": "fr",
    "audio_file_id": "EXAMPLE_FILE_ID"
  },
  "vehicle": {
    "make": "Renault",
    "model": "Clio",
    "year": 2015,
    "fuel": "diesel",
    "mileage_km": null
  },
  "symptom": {
    "description": "témoin de pression d'huile allumé en virage, bruit de claquement léger au ralenti",
    "context": "idle",
    "missing_info": []
  },
  "audio": {
    "status": "ok",
    "label": "low_oil",
    "context": "idle",
    "top3": [
      {
        "label": "low_oil",
        "prob": 0.62
      },
      {
        "label": "tappet",
        "prob": 0.21
      },
      {
        "label": "normal",
        "prob": 0.09
      }
    ],
    "anomaly_score": 0.84,
    "confidence": "medium",
    "description": {
      "duration_s": 12.0,
      "dominant_freq_hz": 120.0,
      "periodic": false,
      "period_ms": null,
      "speech_ratio": 0.05,
      "summary": "Light irregular ticking at idle, steady rhythm."
    },
    "model_version": "mock-0.1",
    "warnings": []
  }
}