{
  "case_id": "case_clio_001",
  "chat_id": "123456789",
  "status": "waiting_checks",
  "round": 1,
  "created_at": "2026-10-20T09:00:00+01:00",
  "user_input": {
    "text": "Ma Clio 2015 diesel grince au démarrage à froid.",
    "voice_transcript": null,
    "language": "fr",
    "audio_file_id": "EXAMPLE_FILE_ID"
  },
  "vehicle": {
    "make": "Renault",
    "model": "Clio",
    "year": 2015,
    "fuel": "diesel",
    "mileage_km": null
  },
  "symptom": {
    "description": "grincement au démarrage à froid",
    "context": "startup",
    "missing_info": []
  },
  "audio": {
    "status": "ok",
    "label": "belt",
    "context": "startup",
    "top3": [
      {
        "label": "belt",
        "prob": 0.78
      },
      {
        "label": "power_steering",
        "prob": 0.12
      },
      {
        "label": "normal",
        "prob": 0.06
      }
    ],
    "anomaly_score": 0.81,
    "confidence": "medium",
    "description": {
      "duration_s": 12.0,
      "dominant_freq_hz": 2600.0,
      "periodic": true,
      "period_ms": null,
      "speech_ratio": 0.05,
      "summary": "High-pitched squeal that follows engine speed."
    },
    "model_version": "mock-0.1",
    "warnings": []
  },
  "diagnosis": [
    {
      "pass": 1,
      "causes": [
        {
          "name": "Courroie d'accessoires usée ou détendue",
          "label": "belt",
          "prob": 0.8,
          "evidence": [
            "Un sifflement aigu au démarrage ou au ralenti peut indiquer une courroie d'accessoires détendue ou usée [peugeot208_fr_p142_c3].",
            "L'analyse acoustique suggère un patinage de courroie avec une confiance moyenne.",
            "passage peugeot208_fr_p142_c3"
          ]
        },
        {
          "name": "Patinage accentué par la pompe de direction assistée ou la charge accessoire",
          "label": "power_steering",
          "prob": 0.2,
          "evidence": [
            "Le patinage de la courroie augmente avec l'effort de direction ou la charge électrique [obdex_generic_belt_1].",
            "L'analyse sonore mentionne la pompe de direction assistée comme alternative (confiance moyenne).",
            "passage obdex_generic_belt_1"
          ]
        }
      ],
      "checks": [
        {
          "id": "c1",
          "q": "Moteur coupé, observez-vous des fissures, un aspect brillant (glaçage) ou du jeu sur la courroie d'accessoires ?",
          "why": "Permet de vérifier directement l'état visuel et la tension de la courroie.",
          "answer_type": "yes_no",
          "citation": {
            "chunk_id": "peugeot208_fr_p143_c1",
            "source": "EXAMPLE_peugeot_208_2019-2023_fr.pdf",
            "page": 143,
            "verified": true
          }
        },
        {
          "id": "c2",
          "q": "A l'arrêt, le grincement s'amplifie-t-il lorsque vous braquez le volant ou que vous allumez les phares et le dégivrage ?",
          "why": "Le patinage de la courroie s'accroît sous l'effet de la charge électrique ou de la direction.",
          "answer_type": "yes_no",
          "citation": {
            "chunk_id": "obdex_generic_belt_1",
            "source": "obdex",
            "page": null,
            "verified": true
          }
        },
        {
          "id": "c3",
          "q": "Le sifflement aigu survient-il uniquement au démarrage et au ralenti avant de diminuer à chaud ?",
          "why": "Un sifflement aigu apparaissant principalement au démarrage ou au ralenti pointe vers la courroie d'accessoires.",
          "answer_type": "yes_no",
          "citation": {
            "chunk_id": "peugeot208_fr_p142_c3",
            "source": "EXAMPLE_peugeot_208_2019-2023_fr.pdf",
            "page": 142,
            "verified": true
          }
        }
      ],
      "conclusive": false,
      "message_to_user": "La cause la plus probable de ce grincement au démarrage à froid est une courroie d'accessoires usée ou détendue. Il est également possible que le bruit soit accentué lors des sollicitations de la direction assistée ou des équipements électriques.\n\nVous pouvez réaliser quelques vérifications très simples sans outils pour préciser le problème.",
      "safety_stop": false
    }
  ],
  "check_answers": [
    {
      "check_id": "c1",
      "answer": "non",
      "round": 1
    },
    {
      "check_id": "c2",
      "answer": "oui",
      "round": 1
    },
    {
      "check_id": "c3",
      "answer": "oui",
      "round": 1
    }
  ]
}