{
  "case_id": "case_clio_011",
  "chat_id": "123456789",
  "status": "audio_analysed",
  "round": 0,
  "created_at": "2026-10-20T09:00:00+01:00",
  "user_input": {
    "text": "La direction de ma Clio est devenue très dure d'un coup et ça gémit quand je tourne.",
    "voice_transcript": null,
    "language": "fr",
    "audio_file_id": "EXAMPLE_FILE_ID"
  },
  "vehicle": {
    "make": "Renault",
    "model": "Clio",
    "year": 2015,
    "fuel": "diesel",
    "mileage_km": null
  },
  "symptom": {
    "description": "direction très dure d'un seul coup, gémissement en braquant",
    "context": "driving",
    "missing_info": []
  },
  "audio": {
    "status": "ok",
    "label": "power_steering",
    "context": "driving",
    "top3": [
      {
        "label": "power_steering",
        "prob": 0.66
      },
      {
        "label": "suspension",
        "prob": 0.2
      },
      {
        "label": "normal",
        "prob": 0.08
      }
    ],
    "anomaly_score": 0.83,
    "confidence": "medium",
    "description": {
      "duration_s": 12.0,
      "dominant_freq_hz": 120.0,
      "periodic": false,
      "period_ms": null,
      "speech_ratio": 0.05,
      "summary": "Continuous whine that rises when the wheel is turned."
    },
    "model_version": "mock-0.1",
    "warnings": []
  }
}