{
  "case_id": "case_clio_002",
  "chat_id": "123456789",
  "status": "audio_analysed",
  "round": 0,
  "created_at": "2026-10-20T09:00:00+01:00",
  "user_input": {
    "text": "Ma Clio 2015 diesel ne démarre pas ce matin, j'entends juste un clic.",
    "voice_transcript": null,
    "language": "fr",
    "audio_file_id": "EXAMPLE_FILE_ID"
  },
  "vehicle": {
    "make": "Renault",
    "model": "Clio",
    "year": 2015,
    "fuel": "diesel",
    "mileage_km": null
  },
  "symptom": {
    "description": "le démarreur ne tourne pas, j'entends seulement un clic, le voyant de batterie est allumé",
    "context": "startup",
    "missing_info": []
  },
  "audio": {
    "status": "ok",
    "label": "dead_battery",
    "context": "startup",
    "top3": [
      {
        "label": "dead_battery",
        "prob": 0.7
      },
      {
        "label": "bad_ignition",
        "prob": 0.18
      },
      {
        "label": "normal_startup",
        "prob": 0.05
      }
    ],
    "anomaly_score": 0.88,
    "confidence": "medium",
    "description": {
      "duration_s": 12.0,
      "dominant_freq_hz": 120.0,
      "periodic": false,
      "period_ms": null,
      "speech_ratio": 0.05,
      "summary": "Single dry click at key turn, no cranking sound."
    },
    "model_version": "mock-0.1",
    "warnings": []
  }
}