{
  "case_id": "case_0001",
  "chat_id": "123456789",
  "status": "done",
  "round": 1,
  "created_at": "2026-10-20T10:15:00+01:00",
  "user_input": {
    "text": "Ma 208 essence de 2020 siffle au ralenti surtout le matin",
    "voice_transcript": null,
    "language": "fr",
    "audio_file_id": "EXAMPLE_FILE_ID"
  },
  "vehicle": {
    "make": "Peugeot",
    "model": "208",
    "year": 2020,
    "fuel": "petrol",
    "mileage_km": null
  },
  "symptom": {
    "description": "sifflement au ralenti, surtout le matin",
    "context": "idle",
    "missing_info": []
  },
  "audio": {
    "status": "ok",
    "label": "belt",
    "context": "idle",
    "top3": [
      {
        "label": "belt",
        "prob": 0.71
      },
      {
        "label": "power_steering",
        "prob": 0.17
      },
      {
        "label": "normal",
        "prob": 0.06
      }
    ],
    "anomaly_score": 0.82,
    "confidence": "medium",
    "description": {
      "duration_s": 9.6,
      "dominant_freq_hz": 2850.0,
      "periodic": false,
      "period_ms": null,
      "speech_ratio": 0.04,
      "summary": "Continuous high-pitched squeal around 2.8 kHz at idle, not periodic."
    },
    "model_version": "mock-0.1",
    "warnings": [
      "Mock answer: real model not plugged in yet."
    ]
  },
  "diagnosis": [
    {
      "pass": 1,
      "causes": [
        {
          "name": "Courroie d'accessoires détendue ou usée",
          "label": "belt",
          "prob": 0.65,
          "evidence": [
            "audio: belt 0.71, squeal 2.8 kHz",
            "user: bruit au ralenti, surtout le matin"
          ]
        },
        {
          "name": "Galet tendeur ou enrouleur défaillant",
          "label": null,
          "prob": 0.2,
          "evidence": [
            "passage peugeot208_fr_p142_c3"
          ]
        },
        {
          "name": "Pompe de direction assistée",
          "label": "power_steering",
          "prob": 0.15,
          "evidence": [
            "audio: power_steering 0.17"
          ]
        }
      ],
      "checks": [
        {
          "id": "c1",
          "q": "Le sifflement augmente-t-il quand vous tournez le volant à l'arrêt ?",
          "why": "Distingue la direction assistée de la courroie.",
          "answer_type": "yes_no",
          "citation": {
            "chunk_id": "obdex_generic_belt_1",
            "source": "obdex",
            "page": null,
            "verified": true
          }
        },
        {
          "id": "c2",
          "q": "Moteur coupé, voyez-vous des fissures ou un aspect brillant sur la courroie ?",
          "why": "Signes d'usure ou de glissement.",
          "answer_type": "yes_no",
          "citation": {
            "chunk_id": "peugeot208_fr_p143_c1",
            "source": "EXAMPLE_peugeot_208_2019-2023_fr.pdf",
            "page": 143,
            "verified": true
          }
        },
        {
          "id": "c3",
          "q": "Le bruit change-t-il quand vous allumez les phares et la climatisation ?",
          "why": "Une charge électrique fait glisser une courroie détendue.",
          "answer_type": "yes_no",
          "citation": {
            "chunk_id": "peugeot208_fr_p142_c3",
            "source": "EXAMPLE_peugeot_208_2019-2023_fr.pdf",
            "page": 142,
            "verified": true
          }
        }
      ],
      "conclusive": false,
      "message_to_user": "Merci ! Pour confirmer, répondez à ces 3 questions :",
      "safety_stop": false
    }
  ],
  "check_answers": [
    {
      "check_id": "c1",
      "answer": "non",
      "round": 1
    },
    {
      "check_id": "c2",
      "answer": "oui",
      "round": 1
    },
    {
      "check_id": "c3",
      "answer": "oui",
      "round": 1
    }
  ],
  "repair": {
    "status": "ok",
    "fault": "Courroie d'accessoires usée",
    "steps": [
      {
        "n": 1,
        "action": "Coupez le moteur, retirez la clé et attendez que le moteur refroidisse.",
        "warning": "Ne jamais toucher la courroie moteur tournant.",
        "citation": {
          "chunk_id": "peugeot208_fr_p143_c1",
          "source": "EXAMPLE_peugeot_208_2019-2023_fr.pdf",
          "page": 143,
          "verified": true
        }
      },
      {
        "n": 2,
        "action": "Inspectez la courroie : fissures, morceaux manquants, aspect glacé.",
        "warning": null,
        "citation": {
          "chunk_id": "peugeot208_fr_p143_c1",
          "source": "EXAMPLE_peugeot_208_2019-2023_fr.pdf",
          "page": 143,
          "verified": true
        }
      },
      {
        "n": 3,
        "action": "Si elle est abîmée, faites-la remplacer avec le galet tendeur.",
        "warning": null,
        "citation": {
          "chunk_id": "peugeot208_fr_p142_c3",
          "source": "EXAMPLE_peugeot_208_2019-2023_fr.pdf",
          "page": 142,
          "verified": true
        }
      }
    ],
    "tools": [
      "lampe torche"
    ],
    "parts": [
      "courroie d'accessoires",
      "galet tendeur (recommandé)"
    ],
    "difficulty": "medium",
    "estimated_time_min": 60,
    "confidence": "medium",
    "see_mechanic": true,
    "safety_warnings": [
      "Si la courroie casse, la direction assistée et la charge de la batterie peuvent s'arrêter."
    ],
    "message_to_user": "Diagnostic probable : courroie d'accessoires usée. Voici les étapes...",
    "voice_summary": "Votre courroie d'accessoires semble usée. Inspectez-la moteur coupé, et faites-la remplacer rapidement avec son galet tendeur."
  },
  "errors": []
}