{
  "case_id": "case_clio_002",
  "chat_id": "123456789",
  "status": "waiting_checks",
  "round": 1,
  "created_at": "2026-10-20T09:00:00+01:00",
  "user_input": {
    "text": "Ma Clio 2015 diesel ne démarre pas ce matin, j'entends juste un clic.",
    "voice_transcript": null,
    "language": "fr",
    "audio_file_id": "EXAMPLE_FILE_ID"
  },
  "vehicle": {
    "make": "Renault",
    "model": "Clio",
    "year": 2015,
    "fuel": "diesel",
    "mileage_km": null
  },
  "symptom": {
    "description": "le démarreur ne tourne pas, j'entends seulement un clic, le voyant de batterie est allumé",
    "context": "startup",
    "missing_info": []
  },
  "audio": {
    "status": "ok",
    "label": "dead_battery",
    "context": "startup",
    "top3": [
      {
        "label": "dead_battery",
        "prob": 0.7
      },
      {
        "label": "bad_ignition",
        "prob": 0.18
      },
      {
        "label": "normal_startup",
        "prob": 0.05
      }
    ],
    "anomaly_score": 0.88,
    "confidence": "medium",
    "description": {
      "duration_s": 12.0,
      "dominant_freq_hz": 120.0,
      "periodic": false,
      "period_ms": null,
      "speech_ratio": 0.05,
      "summary": "Single dry click at key turn, no cranking sound."
    },
    "model_version": "mock-0.1",
    "warnings": []
  },
  "diagnosis": [
    {
      "pass": 1,
      "causes": [
        {
          "name": "déchargée ou hors d’usage",
          "label": "dead_battery",
          "prob": 0.6,
          "evidence": [
            "clio4ph1fr_p225_c1",
            "passage clio4ph1fr_p225_c1"
          ]
        },
        {
          "name": "cosses de batterie mal serrées, débranchées ou oxydées",
          "label": "dead_battery",
          "prob": 0.4,
          "evidence": [
            "clio4ph1fr_p225_c1",
            "passage clio4ph1fr_p225_c1"
          ]
        }
      ],
      "checks": [
        {
          "id": "c1",
          "q": "Est-ce que vous avez vérifié la tension de la batterie avec un chargeur de batterie ou un multimètre ?",
          "why": "Un test de tension peut aider à déterminer si la batterie est déchargée ou si les cosses sont mal serrées, débranchées ou oxydées.",
          "answer_type": "yes_no",
          "citation": {
            "chunk_id": "clio4ph1fr_p225_c1",
            "source": "renault_clio4_2012-2016_fr.pdf",
            "page": 225,
            "verified": true
          }
        },
        {
          "id": "c2",
          "q": "Est-ce que vous avez vérifié si les cosses de batterie sont bien serrées et propres ?",
          "why": "Des cosses de batterie mal serrées ou oxydées peuvent empêcher le démarreur de fonctionner correctement.",
          "answer_type": "yes_no",
          "citation": {
            "chunk_id": "clio4ph1fr_p225_c1",
            "source": "renault_clio4_2012-2016_fr.pdf",
            "page": 225,
            "verified": true
          }
        }
      ],
      "conclusive": false,
      "message_to_user": "Le plus probable est que votre batterie soit déchargée ou que les cosses de batterie soient mal serrées ou oxydées. Cependant, il est important de vérifier la tension de la batterie et de bien nettoyer et resserrer les cosses de batterie. Soyez prudent jusqu'à ce que vous ayez vérifié ces points, car une batterie déchargée peut causer des problèmes de démarrage. Si ces vérifications ne résolvent pas le problème, envisagez de consulter un mécanicien.",
      "safety_stop": false
    }
  ],
  "check_answers": [
    {
      "check_id": "c1",
      "answer": "non, la batterie semble neuve, les voyants restent allumés quand je démarre",
      "round": 1
    },
    {
      "check_id": "c2",
      "answer": "oui, les cosses sont propres et serrées",
      "round": 1
    }
  ]
}