{
  "case_id": "case_p208_012",
  "chat_id": "123456789",
  "status": "audio_analysed",
  "round": 0,
  "created_at": "2026-10-20T09:00:00+01:00",
  "user_input": {
    "text": "Le témoin de charge de la batterie reste allumé sur ma 208 et le moteur tourne mal.",
    "voice_transcript": null,
    "language": "fr",
    "audio_file_id": "EXAMPLE_FILE_ID"
  },
  "vehicle": {
    "make": "Peugeot",
    "model": "208",
    "year": 2016,
    "fuel": "petrol",
    "mileage_km": null
  },
  "symptom": {
    "description": "témoin de charge de la batterie allumé en permanence",
    "context": "driving",
    "missing_info": []
  },
  "audio": {
    "status": "ok",
    "label": "alternator",
    "context": "driving",
    "top3": [
      {
        "label": "alternator",
        "prob": 0.58
      },
      {
        "label": "dead_battery",
        "prob": 0.22
      },
      {
        "label": "normal",
        "prob": 0.1
      }
    ],
    "anomaly_score": 0.8,
    "confidence": "medium",
    "description": {
      "duration_s": 12.0,
      "dominant_freq_hz": 120.0,
      "periodic": false,
      "period_ms": null,
      "speech_ratio": 0.05,
      "summary": "Faint whine that follows engine speed."
    },
    "model_version": "mock-0.1",
    "warnings": []
  }
}